{
  "name": "ArkHook",
  "source": "community",
  "verified": false,
  "category": "Rewards",
  "klass": "VALUE",
  "template": "freeform",
  "stage": "deployed",
  "flags": "0x44",
  "addresses": {
    "ethereum": "0x30ca6f7b31b65b7977bd3991c532ce255bff0044"
  },
  "mechanic": "Charges a configurable buy/sell fee on each swap and routes it to a fee router.",
  "plain": "Takes a configurable fee from the output of every buy and sell, pulls it from the pool manager and forwards it to an external fee router. Can also trigger onchain maintenance like a buyback after a swap.",
  "rules": [
    "Every buy and sell pays a configurable fee, skimmed from the output.",
    "Collected fees route to an external fee router set by the owner."
  ],
  "date": "2026-09-03"
}
