{
  "name": "BuybackBurnHookV1",
  "source": "community",
  "verified": false,
  "category": "Rewards",
  "klass": "VALUE",
  "template": "freeform",
  "stage": "deployed",
  "flags": "0x20CC",
  "addresses": {
    "robinhood": "0x7aa716e1a2dad5309abeca3e8c75abfed287a0cc"
  },
  "mechanic": "Directional fees fund buying the pool's token back and burning it.",
  "plain": "Charges fixed buy and sell fees depending on trade shape, takes a protocol cut, and spends the rest buying the pool's own token on sells and burning it.",
  "rules": [
    "Buys and sells pay fixed directional fees.",
    "Sell fees buy back the pool token and burn it."
  ],
  "date": "2026-09-03"
}
