{
  "name": "Spot",
  "source": "community",
  "verified": false,
  "category": "Fees",
  "klass": "FEE",
  "template": "dynamic",
  "stage": "deployed",
  "flags": "0x10CC",
  "addresses": {
    "monad": "0xb4f4949e8d0a177bb6d2fea33e9516bb219610cc"
  },
  "mechanic": "Full-range AMM with an oracle-set base + surge fee, reinvesting the protocol cut.",
  "plain": "A full-range AMM hook with a truncated geometric-mean oracle that adjusts LP fees (base plus surge) from tick movement, takes a protocol fee share on each swap and reinvests it into a full-range position.",
  "rules": [
    "LP fees combine a base rate and an oracle-driven surge.",
    "The protocol fee share reinvests into a full-range position."
  ],
  "date": "2026-09-03"
}
