{
  "name": "Aquinas Hook",
  "source": "community",
  "verified": false,
  "category": "Access",
  "klass": "GATE",
  "template": "freeform",
  "stage": "deployed",
  "flags": "0x2000",
  "addresses": {
    "base": "0xd3c1f2174f37f88811f99b1b1b4c1356c0246000"
  },
  "mechanic": "Only factory-approved Safe addresses can initialize the pool.",
  "plain": "Restricts pool initialization to Safe addresses pre-approved by the Aquinas factory, preventing anyone from frontrunning LP initialization.",
  "rules": [
    "Only Aquinas-factory-approved Safe addresses can initialize a pool.",
    "Unapproved initialization attempts revert."
  ],
  "date": "2026-09-03"
}
