{
  "name": "AlphixLVRFee",
  "source": "community",
  "verified": false,
  "category": "Fees",
  "klass": "FEE",
  "template": "freeform",
  "stage": "deployed",
  "flags": "0x1044",
  "addresses": {
    "base": "0x7cBbfF9C4fcd74B221C535F4fB4B1Db04F1B9044"
  },
  "mechanic": "Admin-tuned per-pool LP fee plus a protocol fee skimmed to a treasury.",
  "plain": "Combines a per-pool LP fee that a restricted admin can adjust with a protocol fee captured from each swap's output as ERC-6909 claims and forwarded to a treasury.",
  "rules": [
    "A restricted admin sets the per-pool LP fee.",
    "A protocol fee is skimmed from swap output to a treasury."
  ],
  "date": "2026-09-03"
}
