{
  "name": "SafeSwap",
  "source": "community",
  "verified": false,
  "category": "Launch",
  "klass": "GATE",
  "template": "freeform",
  "stage": "deployed",
  "flags": "0x20C0",
  "addresses": {
    "arbitrum": "0x3e61d0519d598bf2dfaef5b8fa0256bf7e1d60c0"
  },
  "mechanic": "Anti-rug and anti-whale: sell rate limits, cooldowns and progressive fees.",
  "plain": "Protects a pool with sell rate limiting, per-address cooldowns, progressive fees and a launch-protection mode. The config is immutable per pool once set.",
  "rules": [
    "Sells are rate-limited with per-address cooldowns.",
    "Progressive fees and a launch-protection mode deter rug and whale activity."
  ],
  "date": "2026-09-03"
}
