{
  "name": "ArcheryFeeHookV2",
  "source": "community",
  "verified": false,
  "category": "Launch",
  "klass": "GATE",
  "template": "freeform",
  "stage": "deployed",
  "flags": "0x20CC",
  "addresses": {
    "robinhood": "0xd790922706d434f7925b4998a4fe72feb68ae0cc"
  },
  "mechanic": "Swaps pay up to 20% unless you present a voucher won in an archery mini-game.",
  "plain": "Every swap pays a configurable fee (up to 20%) collected in ETH, unless the swapper presents a short-lived signed voucher earned in an off-chain archery mini-game. The registrar can only ever lower the fee.",
  "rules": [
    "Swaps pay the default fee unless a valid game voucher is shown.",
    "The fee can only be ratcheted down, never up."
  ],
  "date": "2026-09-03"
}
