{
  "name": "AlphaHook3Pct",
  "source": "community",
  "verified": false,
  "category": "Fees",
  "klass": "FEE",
  "template": "dynamic",
  "stage": "deployed",
  "flags": "0x20C4",
  "addresses": {
    "bnb": "0x10d46c0ea45c5257a1e29c8dced7ede70125e0c4"
  },
  "mechanic": "Dynamic LP fee from 0.30% to 3.00%, driven by volatility and volume EMAs.",
  "plain": "A fee hook for BSC token/stablecoin pools. It moves the LP fee between 0.30% and 3.00% from exponential moving averages of volatility and volume, and seeds new pools at the fee ceiling.",
  "rules": [
    "LP fee floats between 0.30% and 3.00%.",
    "The fee is driven by volatility and volume EMAs, not set by hand."
  ],
  "date": "2026-09-03"
}
