{
  "name": "IndexHook",
  "source": "community",
  "verified": false,
  "category": "Access",
  "klass": "GATE",
  "template": "freeform",
  "stage": "deployed",
  "flags": "0x15D8",
  "addresses": {
    "bnb": "0x91fb28d8f4906df4e8c71806dfeb882dd82815d8"
  },
  "mechanic": "Gates swaps and liquidity to owner-approved IndexToken pools, with a zero-fee option.",
  "plain": "For IndexToken pools: swaps and liquidity add/remove are restricted to pools the owner has approved. Supports dynamic LP fees with a zero-fee override.",
  "rules": [
    "Only owner-approved pools may swap or change liquidity.",
    "The LP fee is dynamic, with an optional zero-fee override."
  ],
  "date": "2026-09-03"
}
